{"capabilities":[{"capability_id":"build_verification","cost":"medium","detector":"build_verification","importance":"high","name":"Extension package build verification","noise_risk":"low","phase_hint":1,"recommendation":"Build the extension and validate the produced manifest/package on pull requests."}],"match":{"always":false,"archetypes_any":["browser-extension"],"ecosystems_any":[]},"profile_id":"browser-extension","profile_version":"1"}
