{"capabilities":[{"capability_id":"component_ci_coverage","cost":"medium","detector":"component_ci_coverage","importance":"high","name":"Per-component CI coverage","noise_risk":"medium","phase_hint":1,"recommendation":"Ensure every detected workspace or package is covered by the intended test/build commands without treating the monorepo as one opaque unit."}],"match":{"always":false,"archetypes_any":["node-monorepo"],"ecosystems_any":[]},"profile_id":"node-monorepo","profile_version":"1"}
