{"capabilities":[{"capability_id":"workflow_least_privilege","cost":"low","detector":"workflow_least_privilege","importance":"high","name":"Least-privilege workflow permissions","noise_risk":"low","phase_hint":1,"recommendation":"Declare the minimum required GitHub Actions permissions and avoid broad write access."},{"capability_id":"tests_on_pull_request","cost":"medium","detector":"tests_on_pull_request","importance":"high","name":"Tests execute on pull requests","noise_risk":"low","phase_hint":1,"recommendation":"Run the repository's real test command on pull requests with actionable diagnostics."},{"capability_id":"build_verification","cost":"medium","detector":"build_verification","importance":"medium","name":"Build or package verification","noise_risk":"low","phase_hint":2,"recommendation":"Verify the build or package path that users actually consume."}],"match":{"always":true,"archetypes_any":[],"ecosystems_any":[]},"profile_id":"generic-repository","profile_version":"1"}
