{"capabilities":[{"capability_id":"frontend_build_verification","cost":"medium","detector":"build_verification","importance":"high","name":"Frontend production build","noise_risk":"low","phase_hint":1,"recommendation":"Run the production frontend build and fail on unresolved imports, type errors, or bundler errors."}],"match":{"always":false,"archetypes_any":["node-frontend-application"],"ecosystems_any":[]},"profile_id":"node-frontend","profile_version":"1"}
