{"capabilities":[{"capability_id":"documentation_validation","cost":"low","detector":"documentation_validation","importance":"medium","name":"Documentation contract validation","noise_risk":"medium","phase_hint":2,"recommendation":"Validate links, structured examples, and generated documentation only where the repository has machine-checkable contracts."}],"match":{"always":false,"archetypes_any":["documentation-only-repository"],"ecosystems_any":[]},"profile_id":"documentation-only","profile_version":"1"}
