{"capabilities":[{"capability_id":"schema_validation","cost":"low","detector":"schema_validation","importance":"critical","name":"Schema and example validation","noise_risk":"low","phase_hint":1,"recommendation":"Validate every active schema and committed example with explicit negative cases."},{"capability_id":"negative_validation_cases","cost":"low","detector":"negative_validation_cases","importance":"high","name":"Negative parser or validator cases","noise_risk":"low","phase_hint":1,"recommendation":"Add invalid fixtures that prove the validator rejects unsupported or malformed input."}],"match":{"always":false,"archetypes_any":["contract-schema-repository"],"ecosystems_any":[]},"profile_id":"contract-schema-repository","profile_version":"1"}
