{"capabilities":[{"capability_id":"dependency_reproducibility","cost":"medium","detector":"dependency_reproducibility","importance":"medium","name":"Reproducible Python dependencies","noise_risk":"low","phase_hint":2,"recommendation":"Use a lock or reproducible dependency contract appropriate to the Python project type."},{"capability_id":"static_validation","cost":"low","detector":"static_validation","importance":"medium","name":"Python static validation","noise_risk":"medium","phase_hint":2,"recommendation":"Wire an existing Python linter or type checker into CI, or add the lightest compatible validator when none exists."},{"applies_to_archetypes":["python-package"],"capability_id":"package_release_verification","cost":"medium","detector":"package_release_verification","importance":"medium","name":"Python package and release verification","noise_risk":"low","phase_hint":2,"recommendation":"Build the distribution and validate package metadata before release."}],"match":{"always":false,"archetypes_any":[],"ecosystems_any":["python"]},"profile_id":"python-ecosystem","profile_version":"1"}
