{"capabilities":[{"capability_id":"worker_contract_tests","cost":"medium","detector":"worker_contract_tests","importance":"high","name":"Worker retry and idempotency tests","noise_risk":"low","phase_hint":1,"recommendation":"Add deterministic tests for retry, idempotency, malformed payloads, and failure acknowledgement behavior."}],"match":{"always":false,"archetypes_any":["python-async-worker"],"ecosystems_any":[]},"profile_id":"python-async-worker","profile_version":"1"}
