{"capabilities":[{"capability_id":"cross_repository_contract","cost":"high","detector":"cross_repository_contract","importance":"high","name":"Cross-repository contract validation","noise_risk":"medium","phase_hint":2,"recommendation":"Validate shared contracts or adapter mappings against accessible sibling-repository evidence; defer when access is unavailable."}],"match":{"always":false,"archetypes_any":["multi-repository-adapter"],"ecosystems_any":[]},"profile_id":"multi-repository-integration","profile_version":"1"}
