{"capabilities":[{"capability_id":"dependency_reproducibility","cost":"low","detector":"dependency_reproducibility","importance":"high","name":"Reproducible Node dependencies","noise_risk":"low","phase_hint":1,"recommendation":"Keep and use the package-manager lockfile with frozen installation in CI."},{"capability_id":"static_validation","cost":"low","detector":"static_validation","importance":"medium","name":"Node static validation","noise_risk":"medium","phase_hint":2,"recommendation":"Run the repository's configured lint or type-check command in CI."}],"match":{"always":false,"archetypes_any":[],"ecosystems_any":["node"]},"profile_id":"node-ecosystem","profile_version":"1"}
