{"capabilities":[{"capability_id":"api_contract_validation","cost":"medium","detector":"api_contract_validation","importance":"high","name":"API contract validation","noise_risk":"low","phase_hint":1,"recommendation":"Add a deterministic API contract or route smoke test for critical endpoints and error paths."},{"capability_id":"negative_validation_cases","cost":"medium","detector":"negative_validation_cases","importance":"high","name":"Negative request validation cases","noise_risk":"low","phase_hint":1,"recommendation":"Test invalid inputs, authorization boundaries, and stable error contracts for critical API paths."}],"match":{"always":false,"archetypes_any":["python-api-service","python-django-application"],"ecosystems_any":[]},"profile_id":"python-api-service","profile_version":"1"}
