{"capabilities":[{"capability_id":"data_contract_validation","cost":"medium","detector":"data_contract_validation","importance":"high","name":"Data contract validation","noise_risk":"low","phase_hint":1,"recommendation":"Validate input/output schemas and representative malformed data before pipeline or model execution."},{"capability_id":"artifact_reproducibility","cost":"high","detector":"artifact_reproducibility","importance":"medium","name":"Artifact reproducibility","noise_risk":"medium","phase_hint":2,"recommendation":"Record and validate the inputs, dependency lock, and metadata needed to reproduce generated artifacts."}],"match":{"always":false,"archetypes_any":["python-data-pipeline","python-ml-service"],"ecosystems_any":[]},"profile_id":"python-data-and-ml","profile_version":"1"}
