{"capabilities":[{"capability_id":"api_contract_validation","cost":"medium","detector":"api_contract_validation","importance":"high","name":"Service contract validation","noise_risk":"low","phase_hint":1,"recommendation":"Exercise critical service routes, error responses, and configuration startup in CI."}],"match":{"always":false,"archetypes_any":["node-service"],"ecosystems_any":[]},"profile_id":"node-service","profile_version":"1"}
